<?xml version="1.0" encoding="UTF-8"?>
<graphs xmlns:xsd="http://www.w3.org/2001/XMLSchema-instance" xsd:noNamespaceSchemaLocation="../schema/xml_components.xsd">
	<graph>
		<node name="fw" functional_type="ACL_FIREWALL">
			<neighbour name="webserver1"/>
			<neighbour name="nat"/>
		</node>
		<node name="webserver1" functional_type="WEBSERVER">
			<neighbour name="sap3"/>
			<neighbour name="fw"/>
		</node>
		<node name="nat" functional_type="NAT">
			<neighbour name="sap1"/>
			<neighbour name="dpi"/>
			<neighbour name="fw"/>
		</node>
		<node name="dpi" functional_type="DPI">
			<neighbour name="sap2"/>
		</node>
		<node name="sap2" functional_type="END_HOST">
			<neighbour name="nat"/>
		</node>
		<node name="sap1" functional_type="END_HOST">
			<neighbour name="nat"/>
		</node>
		<node name="sap3" functional_type="END_HOST">
			<neighbour name="webserver1"/>
		</node>
	</graph>
</graphs>