<?xml version="1.0" encoding="UTF-8"?>
<graphs xmlns:xsd="http://www.w3.org/2001/XMLSchema-instance" xsd:noNamespaceSchemaLocation="../schema/xml_components.xsd">
	<graph>
		<node name="user1" functional_type="END_HOST">
			<neighbour name="nat"/>
		</node>
		<node name="nat" functional_type="NAT">
			<neighbour name="user1"/>
			<neighbour name="vpnaccess"/>
		</node>
		<node name="vpnaccess" functional_type="VPN_ACCESS">
			<neighbour name="nat"/>
			<neighbour name="fieldmodifier"/>
		</node>
		<node name="fieldmodifier" functional_type="FIELDMODIFIER">
			<neighbour name="vpnaccess"/>
			<neighbour name="vpnexit"/>
		</node>
		<node name="vpnexit" functional_type="VPN_EXIT">
			<neighbour name="fieldmodifier"/>
			<neighbour name="webserver"/>
		</node>
		<node name="webserver" functional_type="WEBSERVER">
			<neighbour name="vpnexit"/>
		</node>
	</graph>
</graphs>