<?xml version="1.0" encoding="UTF-8"?>
<graphs xmlns:xsd="http://www.w3.org/2001/XMLSchema-instance" xsd:noNamespaceSchemaLocation="../schema/xml_components.xsd">
	<graph>
		<node name="user1" functional_type="END_HOST">
			<neighbour name="nat"/>
		</node>
		<node name="nat" functional_type="NAT">
			<neighbour name="dpi"/>
		</node>
		<node name="dpi" functional_type="DPI">
			<neighbour name="webserver"/>
		</node>
		<node name="webserver" functional_type="WEBSERVER"></node>
	</graph>
</graphs>